sentence;type
Iphone X bản 64gb vàng đốm giờ giá nhiêu vậy?, hả bà xã;hoi_gia
Giảm giá 1tr4 là còn 3tr6 phải không bạn;hoi_gia
Mình muốn mua máy cũ thì không biết giá nhiêu nhỉ, mà có chất lượng không?;hoi_gia
Ở Thái Nguyên giá SS8+ giờ nhiêu;hoi_gia
Mình muốn mua Iphone X hàng nhập khẩu từ Mỹ giá nhiêu;hoi_gia
Bản 64gb mắc hơn 32gb nhiêu;hoi_gia
Giá 22tr2 là tính thuế VAT 10% chưa shop;hoi_gia
Tính thuế nữa là giá nhiêu vậy bạn;hoi_gia
Mua SS9+ có được tặng kèm gì ko shop;hoi_khuyen_mai
Ủa giờ còn giảm giá 1tr không;hoi_khuyen_mai
Mình mua trả góp vậy có được giảm 2tr không;hoi_khuyen_mai
Khi nào hết chương trình giảm giá sốc với đồ tặng kèm cho con này vậy bạn;hoi_khuyen_mai
Máy này sử dụng cục sạc mấy chấu thế;hoi_phan_cung
Sạc thường mấy tiếng mới đầy pin vậy;hoi_phan_cung
Pin xài bao lâu tiếng vậy;hoi_phan_cung
Xài chip gì vậy shop;hoi_phan_cung
Camera trước nhiêu chấm vậy;hoi_phan_cung
Xiaomi này là vỏ nhôm hay nhựa vậy;hoi_phan_cung
Máy này ram nhiêu;hoi_phan_cung
Máy này dung lượng rom là 32 hay 64;hoi_phan_cung
Màn hình con SS9+ nhiêu inch nhỉ;hoi_phan_cung
Có tai thỏ ko shop;hoi_phan_cung
Có tràn màn hình không;hoi_phan_cung
Có này có hỗ trợ 4g được không nhỉ;hoi_phan_cung
Này dùng 1 sim hay 2 sim;hoi_phan_cung
Dùng sim ghép hay thường vậy bạn;hoi_phan_cung
Có chống nước không;hoi_phan_cung;hoi_phan_mem
Ủa máy cài android 6 hay 7;hoi_phan_mem
Mua về có update lên 8 được không;hoi_phan_mem
Xiaomi này có cài sẵn tiếng Việt không, shop có hỗ trợ cài miễn phí hay phải tự cài;hoi_phan_mem
Ủa này hàng từ Mỹ hay Đài Loan bạn;hoi_nguon_hang
Bản Iphone XS này là quốc tế hả;hoi_nguon_hang
Phải mã hàng LL/A không;hoi_nguon_hang
Ủa này là hàng nhập khẩu xách tay hay chính hãng vậy shop;hoi_nguon_hang
Này là mới đập hộp hay like new;hoi_nguon_hang
Chơi liên quân max setting được không;hoi_nhu_cau
Chơi game liên tục 3h được không;hoi_nhu_cau
Không biết con này chơi alpha 8 có lag không ae nhỉ;hoi_nhu_cau
Ủa SS9 note còn ko vậy;hoi_con_hang
Iphone XS xám bạc còn không;hoi_con_hang
Còn màu nào khác không;hoi_con_hang
Ở Thái Nguyên còn Xiaomi red mi 4 không vậy;hoi_con_hang
Còn mã LL/A không shop;hoi_con_hang
Còn bản ram 3gb không;hoi_con_hang
Còn bản 32gb không;hoi_con_hang
Cho xin địa chỉ ở Tiền Giang bạn ơi;hoi_dia_chi
Ở Cần Thơ chỗ nào còn Iphone 8 plus đỏ vậy bạn;hoi_dia_chi
Nào bản Iphone XS có vậy;hoi_khi_nao
Màu đỏ nào có hàng;hoi_khi_nao
Bản 4gb nào về VN;hoi_khi_nao
Bản 32g còn không;hoi_khi_nao
Ở Hà Nội nào có hàng;hoi_khi_nao
thứ 7 tuần này có không, bữa vừa đặt trên shop;hoi_khi_nao
Mình bữa đặt hàng ở Q9, không biết chủ nhật tuần này có hàng chưa để ra lấy;hoi_khi_nao
Tư vấn e trả góp ạ;hoi_tra_gop
Em năm nay 18t, có bằng lái xe trả góp được không;hoi_tra_gop
Trả trước 30% là nhiêu tiền, rồi trả còn lại hết nhiều;hoi_tra_gop
Có hỗ trợ thanh toán qua thẻ tín dụng không;hoi_tra_gop
Có hỗ trợ trả góp qua thẻ ngân hàng hay tín dụng không;hoi_tra_gop
Cần giấy tờ gì để mang ra làm thủ tục trả góp được nhỉ;hoi_tra_gop
Kính cường lực bị vỡ có bảo hành không vậy;hoi_bao_hanh
Vừa mua mà hư loa rồi, cứ rè rè mai ra đổi;hoi_bao_hanh
Mình mới mua con SS9+ ở tgdd, giờ bán lại được không, giá nhiêu;hoi_doi_cu_lay_moi
Mình mới mua con SS9+ ở tgdd, giờ muốn đổi lấy Iphone 8 cần bù tiền không;hoi_doi_cu_lay_moi
Mới mua màu xám mà giờ muốn đổi sang màu đỏ cần bù tiền không;hoi_doi_cu_lay_moi